{
  "$schema": "https://json-schema.org/draft/2020-12/schema",
  "title": "JsonEnvelope",
  "description": "The one common envelope every verb emits. Never prompts; prose (TTY) is rendered from the\nSAME typed value where practical.",
  "type": "object",
  "properties": {
    "command": {
      "description": "The verb that produced this (`add`, `follow`, `pull`, `list`, `publish`, …).",
      "type": "string"
    },
    "data": {
      "description": "Command-specific payload (`{}` when empty).",
      "default": {}
    },
    "error": {
      "description": "The actionable failure detail (when `ok == false`).",
      "anyOf": [
        {
          "$ref": "#/$defs/WireError"
        },
        {
          "type": "null"
        }
      ]
    },
    "messages": {
      "description": "The TYPED message channel — the same lines as `warnings`, in the same order, with the\nmachine-readable code and the kind separated from the prose a person reads. ADDITIVE: a\nproducer that emits nothing omits it, and an envelope without it still parses.",
      "type": "array",
      "items": {
        "$ref": "#/$defs/Message"
      }
    },
    "next_actions": {
      "description": "Stable, machine-actionable next steps — each carries a complete argv.",
      "type": "array",
      "default": [],
      "items": {
        "$ref": "#/$defs/NextAction"
      }
    },
    "ok": {
      "type": "boolean"
    },
    "receipt": {
      "description": "The durable idempotency record — present on **every** terminal op, including failures.",
      "anyOf": [
        {
          "$ref": "#/$defs/Receipt"
        },
        {
          "type": "null"
        }
      ]
    },
    "schema_version": {
      "description": "Always `1` for this contract version (the schema pins it `const`).",
      "type": "integer",
      "format": "uint32",
      "const": 1,
      "minimum": 0
    },
    "warnings": {
      "description": "The LEGACY line channel — one flat string per message, kept in shape and membership for\nconsumers that already match on it. Each entry is derived from the matching [`Message`]:\n`\"{code} {text}\"` when the message carries a code, the bare text when it does not.\nSuperseded by `messages`; it will be retired in a future contract version.",
      "type": "array",
      "default": [],
      "items": {
        "type": "string"
      }
    }
  },
  "required": [
    "schema_version",
    "command",
    "ok"
  ],
  "$defs": {
    "ActionCode": {
      "title": "ActionCode",
      "description": "A machine-actionable next-action code. The values in `examples` are the known set; an unrecognized future code is still valid and MUST be executed via the action's `argv` (never rejected).",
      "type": "string",
      "examples": [
        "PROPOSE_PUBLISH",
        "REBASE_AND_RETRY",
        "RESOLVE_DIVERGED_DRAFT",
        "APPLY_WAITING_UPDATE",
        "DISAMBIGUATE_NAME",
        "REQUEST_ACCESS",
        "RETRY",
        "CONTACT_ADMIN",
        "FETCH_FULL_DIFF",
        "NEXT_PAGE",
        "SELF_UPDATE"
      ]
    },
    "Affected": {
      "description": "What an outcome refers to (every field optional — a policy flip has no skill/version).",
      "type": "object",
      "properties": {
        "proposal": {
          "type": [
            "string",
            "null"
          ]
        },
        "skill": {
          "type": [
            "string",
            "null"
          ]
        },
        "version": {
          "description": "A `version_id` (commit SHA-256, lowercase hex) when the outcome refers to a version.",
          "type": [
            "string",
            "null"
          ],
          "pattern": "^[0-9a-f]{64}$"
        },
        "workspace": {
          "type": [
            "string",
            "null"
          ]
        }
      }
    },
    "Message": {
      "description": "One message: the machine-readable code (when the producer has one), what kind of thing it is,\nand the ONE sentence a person reads. `text` never carries the code — a code is a lookup key,\nnot prose, and the TTY prints `text` alone.",
      "type": "object",
      "properties": {
        "code": {
          "description": "The stable SCREAMING_SNAKE code an agent branches on. Absent where the producer has no\ncode (a decision, a paging fact) — an open vocabulary, exactly like `WireError.code`.",
          "type": [
            "string",
            "null"
          ]
        },
        "kind": {
          "$ref": "#/$defs/MessageKind"
        },
        "text": {
          "description": "The line a person reads. Complete on its own; no code, no Rust type name.",
          "type": "string"
        }
      },
      "required": [
        "kind",
        "text"
      ]
    },
    "MessageKind": {
      "description": "What a [`Message`] IS, so a consumer never has to infer it from wording. `failure` is the only\nkind that says something did not happen; `decision` is a bundle waiting on a person; `advisory`\nannotates something that still worked; `disclosure` states a fact about work that succeeded.",
      "type": "string",
      "enum": [
        "failure",
        "decision",
        "advisory",
        "disclosure"
      ]
    },
    "NextAction": {
      "description": "A machine-actionable next step. The `argv` is the ready-to-exec command; `code` lets an agent\nbranch on the known set and still pass through unknowns. The three safety fields are ADDITIVE\nand optional (absent = unknown) — a producer fills them from its one rules module, never\nper call site, so the classification cannot drift between surfaces.",
      "type": "object",
      "properties": {
        "argv": {
          "description": "A complete argv array — execute as-is (no TTY parsing).",
          "type": "array",
          "items": {
            "type": "string"
          }
        },
        "code": {
          "$ref": "#/$defs/ActionCode"
        },
        "mutates": {
          "description": "Whether executing `argv` CHANGES state — local files (skill bytes, the sidecar) or shared\nworkspace state. Absent = unknown (e.g. a bare `RETRY`, whose safety is the retried\ncommand's own).",
          "type": [
            "boolean",
            "null"
          ]
        },
        "needs": {
          "description": "The placeholder names the `argv` template still needs filled before it can execute — one\nentry per distinct `<name>` token part (e.g. `\"workspace-address\"` for an argv carrying\n`<workspace-address>`). Empty/absent = the argv is complete and executable as-is. ADDITIVE.",
          "type": "array",
          "items": {
            "type": "string"
          }
        },
        "needs_network": {
          "description": "Whether executing `argv` dials the plane. Absent = unknown.",
          "type": [
            "boolean",
            "null"
          ]
        },
        "risk_note": {
          "description": "A one-line caution for an action whose effect a human/agent should weigh before running\n(team-visible moves, local discards). Absent = nothing to flag.",
          "type": [
            "string",
            "null"
          ]
        }
      },
      "required": [
        "code",
        "argv"
      ]
    },
    "Receipt": {
      "description": "The ONE canonical receipt across all outcomes — the durable idempotency record (present even\non failures): one stable receipt per op, identical on retry.",
      "type": "object",
      "properties": {
        "bundle_digest": {
          "description": "The byte-exact consent hash (lowercase hex).",
          "type": [
            "string",
            "null"
          ],
          "pattern": "^[0-9a-f]{64}$"
        },
        "command": {
          "type": "string"
        },
        "created_at": {
          "description": "RFC 3339 timestamp (the plane stamps it; never an ambient clock in `topos-core`).",
          "type": "string",
          "format": "date-time"
        },
        "current_generation": {
          "type": [
            "integer",
            "null"
          ],
          "format": "uint64",
          "minimum": 0
        },
        "details": {
          "description": "Outcome-specific extra detail."
        },
        "expected_generation": {
          "type": [
            "integer",
            "null"
          ],
          "format": "uint64",
          "minimum": 0
        },
        "op_id": {
          "description": "Client-minted UUIDv4, persisted before the first send.",
          "type": "string",
          "format": "uuid"
        },
        "outcome": {
          "$ref": "#/$defs/TerminalOutcome"
        },
        "schema_version": {
          "description": "Always `1` for this contract version (the schema pins it `const`).",
          "type": "integer",
          "format": "uint32",
          "const": 1,
          "minimum": 0
        },
        "skill_id": {
          "type": [
            "string",
            "null"
          ]
        },
        "version_id": {
          "description": "The commit SHA-256 (lowercase hex).",
          "type": [
            "string",
            "null"
          ],
          "pattern": "^[0-9a-f]{64}$"
        },
        "workspace_id": {
          "type": "string"
        }
      },
      "required": [
        "schema_version",
        "op_id",
        "command",
        "outcome",
        "workspace_id",
        "created_at"
      ]
    },
    "TerminalOutcome": {
      "description": "The closed set of terminal outcomes the agent branches on. SCREAMING_SNAKE on the wire.",
      "oneOf": [
        {
          "type": "string",
          "enum": [
            "OK",
            "CONFLICT",
            "DIVERGED",
            "DENIED",
            "UNAVAILABLE",
            "AMBIGUOUS_NAME",
            "RETRYABLE_FAILURE",
            "PERMANENT_FAILURE"
          ]
        },
        {
          "description": "A successfully-opened proposal — an explicit `--propose`, or a direct publish/revert the\nper-bundle protection DOWNGRADED to one (the receipt's `details.downgraded` says which).",
          "type": "string",
          "const": "NEEDS_REVIEW"
        }
      ]
    },
    "WireError": {
      "description": "The flat wire error (rich `thiserror` enums stay internal). Carries a\nstable code + retryability + the safe next actions; never raw SQL/git strings.",
      "type": "object",
      "properties": {
        "affected": {
          "$ref": "#/$defs/Affected",
          "default": {}
        },
        "code": {
          "description": "A stable, machine-branchable error code, distinct from (and finer than) `outcome`. This is an\n**open, additive** string vocabulary — it is intentionally NOT a closed enum: new codes are\nadded over time, and a consumer must treat an unrecognized `code` as the `outcome` it carries.",
          "type": "string"
        },
        "context": {
          "description": "Structured context (no TTY prose to parse).",
          "default": null
        },
        "current_generation": {
          "type": [
            "integer",
            "null"
          ],
          "format": "uint64",
          "minimum": 0
        },
        "expected_generation": {
          "type": [
            "integer",
            "null"
          ],
          "format": "uint64",
          "minimum": 0
        },
        "next_actions": {
          "type": "array",
          "default": [],
          "items": {
            "$ref": "#/$defs/NextAction"
          }
        },
        "outcome": {
          "$ref": "#/$defs/TerminalOutcome"
        },
        "retryable": {
          "type": "boolean"
        }
      },
      "required": [
        "code",
        "outcome",
        "retryable"
      ]
    }
  }
}
