{
  "schema_version": 1,
  "command": "add",
  "ok": false,
  "data": {},
  "warnings": [],
  "next_actions": [
    {
      "code": "DISAMBIGUATE_NAME",
      "argv": [
        "topos",
        "list",
        "--json"
      ],
      "mutates": false,
      "needs_network": false
    },
    {
      "code": "RUN_COMMAND",
      "argv": [
        "topos",
        "add",
        "topos.sh/acme/code-review",
        "--json"
      ]
    }
  ],
  "error": {
    "code": "AMBIGUOUS_SCOPE",
    "outcome": "AMBIGUOUS_NAME",
    "retryable": false,
    "affected": {},
    "context": {
      "message": "the skill 'code-review' in harness 'claude-code' matches 2 directories (/home/ada/.claude/skills/code-review, /work/acme-api/.claude/skills/code-review) — adopt one by path (`topos add <dir>`); every local copy above is byte-identical to what `topos.sh/acme/code-review` serves today — `topos add topos.sh/acme/code-review` subscribes to the team's copy, while adopting a path forks it into a new, unmanaged skill"
    },
    "next_actions": [
      {
        "code": "DISAMBIGUATE_NAME",
        "argv": [
          "topos",
          "list",
          "--json"
        ],
        "mutates": false,
        "needs_network": false
      },
      {
        "code": "RUN_COMMAND",
        "argv": [
          "topos",
          "add",
          "topos.sh/acme/code-review",
          "--json"
        ]
      }
    ]
  }
}
