{
  "schema_version": 1,
  "command": "publish",
  "ok": true,
  "data": {
    "bundle_digest": "bbbbbbbbbbbbbbbbbbbbbbbbbbbbbbbbbbbbbbbbbbbbbbbbbbbbbbbbbbbbbbbb",
    "current_generation": 43,
    "invite_line": "Ask your agent: \"Set up Topos for us: fetch https://topos.sh/agent and follow it. Our workspace: https://topos.sh/acme\"",
    "name": "deploy",
    "share_line": "https://topos.sh/acme/skills/deploy",
    "skill_id": "s_deploy",
    "undo": "topos revert deploy --to aaaaaaaaaaaa",
    "version_id": "dddddddddddddddddddddddddddddddddddddddddddddddddddddddddddddddd",
    "workspace": {
      "host": "topos.sh",
      "name": "acme"
    }
  },
  "warnings": [],
  "next_actions": []
}
