{
  "schema_version": 1,
  "command": "publish",
  "ok": false,
  "data": {},
  "warnings": [],
  "next_actions": [
    {
      "code": "PROPOSE_PUBLISH",
      "argv": [
        "topos",
        "publish",
        "pr-describe",
        "--propose"
      ]
    }
  ],
  "receipt": {
    "schema_version": 1,
    "op_id": "f47ac10b-58cc-4372-a567-0e02b2c3d479",
    "command": "publish",
    "outcome": "APPROVAL_REQUIRED",
    "workspace_id": "w_demo",
    "skill_id": "s_prdescribe",
    "current_generation": {
      "epoch": 1,
      "seq": 42
    },
    "created_at": "2026-06-25T00:00:00Z",
    "key_id": "pk_demo"
  },
  "error": {
    "code": "REVIEW_REQUIRED",
    "outcome": "APPROVAL_REQUIRED",
    "retryable": false,
    "affected": {
      "skill": "pr-describe"
    },
    "context": {},
    "next_actions": [
      {
        "code": "PROPOSE_PUBLISH",
        "argv": [
          "topos",
          "publish",
          "pr-describe",
          "--propose"
        ]
      }
    ]
  }
}
